{
  "scenario": "happy_claim",
  "version": 1,
  "sandbox": true,
  "description": "Eligible settlement value 80.00, advance 64.00, and sufficient settlement.",
  "source": {
    "sellerId": "0198a5ea-7c9c-7000-8000-000000000001",
    "claimId": "0198a5ea-7c9c-7000-8000-000000000101",
    "marketplaceEvents": [
      {
        "eventId": "0198a5ea-7c9c-7000-8000-000000001001",
        "type": "ORDER_SETTLED",
        "occurredAt": "2026-07-15T00:00:00Z",
        "amount": { "amountMinor": "10000", "currency": "TIDR", "scale": 2 }
      }
    ],
    "adapter": { "outcome": "SUCCESS", "retryable": false, "attemptsBeforeSuccess": 1 }
  },
  "expected": {
    "snapshot": {
      "grossUnsettled": { "amountMinor": "10000", "currency": "TIDR", "scale": 2 },
      "eligibleSettlementValue": { "amountMinor": "8000", "currency": "TIDR", "scale": 2 },
      "advanceAmount": { "amountMinor": "6400", "currency": "TIDR", "scale": 2 }
    },
    "evaluation": { "decision": "ELIGIBLE", "jccProjected": true },
    "stateTransitions": ["DRAFT", "ANALYZED", "ELIGIBLE", "CONTROLLED", "ISSUED", "FUNDED", "SETTLING", "REPAID", "REDEEMED", "CLOSED"],
    "reasonCodes": [],
    "errorCode": null,
    "waterfall": {
      "seniorRepaid": { "amountMinor": "6400", "currency": "TIDR", "scale": 2 },
      "firstLossApplied": { "amountMinor": "0", "currency": "TIDR", "scale": 2 },
      "residual": { "amountMinor": "1600", "currency": "TIDR", "scale": 2 },
      "resolutionRequired": false
    }
  }
}
