{
  "scenario": "refund_spike",
  "version": 1,
  "sandbox": true,
  "description": "A refund spike revises ESV before funding without creating senior loss.",
  "source": {
    "sellerId": "0198a5ea-7c9c-7000-8000-000000000002",
    "claimId": "0198a5ea-7c9c-7000-8000-000000000102",
    "marketplaceEvents": [
      {
        "eventId": "0198a5ea-7c9c-7000-8000-000000001002",
        "type": "REFUND",
        "occurredAt": "2026-07-15T00:01:00Z",
        "amount": { "amountMinor": "3000", "currency": "TIDR", "scale": 2 }
      }
    ],
    "adapter": { "outcome": "SUCCESS", "retryable": false, "attemptsBeforeSuccess": 1 }
  },
  "expected": {
    "snapshot": {
      "grossUnsettled": { "amountMinor": "10000", "currency": "TIDR", "scale": 2 },
      "eligibleSettlementValue": { "amountMinor": "5600", "currency": "TIDR", "scale": 2 },
      "advanceAmount": { "amountMinor": "0", "currency": "TIDR", "scale": 2 }
    },
    "evaluation": { "decision": "REVIEW", "jccProjected": true },
    "stateTransitions": ["ELIGIBLE", "REVIEW", "PAUSED"],
    "reasonCodes": ["HIGH_REFUND_RATE"],
    "errorCode": null,
    "waterfall": {
      "seniorRepaid": { "amountMinor": "0", "currency": "TIDR", "scale": 2 },
      "firstLossApplied": { "amountMinor": "0", "currency": "TIDR", "scale": 2 },
      "residual": { "amountMinor": "5600", "currency": "TIDR", "scale": 2 },
      "resolutionRequired": false
    }
  }
}
