{
  "scenario": "missing_data",
  "version": 1,
  "sandbox": true,
  "description": "Missing payout history sends the claim to manual review.",
  "source": {
    "sellerId": "0198a5ea-7c9c-7000-8000-000000000004",
    "claimId": "0198a5ea-7c9c-7000-8000-000000000104",
    "marketplaceEvents": [],
    "adapter": { "outcome": "SUCCESS", "retryable": false, "attemptsBeforeSuccess": 1 }
  },
  "expected": {
    "snapshot": {
      "grossUnsettled": { "amountMinor": "0", "currency": "TIDR", "scale": 2 },
      "eligibleSettlementValue": { "amountMinor": "0", "currency": "TIDR", "scale": 2 },
      "advanceAmount": { "amountMinor": "0", "currency": "TIDR", "scale": 2 }
    },
    "evaluation": { "decision": "REVIEW", "jccProjected": false },
    "stateTransitions": ["DRAFT", "DATA_PENDING", "REVIEW"],
    "reasonCodes": ["MISSING_PAYOUT_HISTORY", "MANUAL_REVIEW_REQUIRED"],
    "errorCode": null
  }
}
