{
  "scenario": "shortfall",
  "version": 1,
  "sandbox": true,
  "description": "Settlement shortfall consumes funded first loss and opens resolution.",
  "source": {
    "sellerId": "0198a5ea-7c9c-7000-8000-000000000003",
    "claimId": "0198a5ea-7c9c-7000-8000-000000000103",
    "marketplaceEvents": [
      {
        "eventId": "0198a5ea-7c9c-7000-8000-000000001003",
        "type": "ORDER_SETTLED",
        "occurredAt": "2026-07-15T00:02:00Z",
        "amount": { "amountMinor": "5000", "currency": "TIDR", "scale": 2 }
      }
    ],
    "adapter": { "outcome": "SUCCESS", "retryable": false, "attemptsBeforeSuccess": 1 }
  },
  "expected": {
    "snapshot": {
      "grossUnsettled": { "amountMinor": "10000", "currency": "TIDR", "scale": 2 },
      "eligibleSettlementValue": { "amountMinor": "8000", "currency": "TIDR", "scale": 2 },
      "advanceAmount": { "amountMinor": "6400", "currency": "TIDR", "scale": 2 }
    },
    "evaluation": { "decision": "ELIGIBLE", "jccProjected": true },
    "stateTransitions": ["FUNDED", "SETTLING", "SHORTFALL", "RESOLUTION", "CLOSED_WITH_LOSS"],
    "reasonCodes": ["SETTLEMENT_SHORTFALL"],
    "errorCode": null,
    "waterfall": {
      "seniorRepaid": { "amountMinor": "5000", "currency": "TIDR", "scale": 2 },
      "firstLossApplied": { "amountMinor": "1000", "currency": "TIDR", "scale": 2 },
      "residual": { "amountMinor": "0", "currency": "TIDR", "scale": 2 },
      "resolutionRequired": true
    }
  }
}
